{
  "cavities": [
    {
      "clearance_mm": 1.0,
      "id": "cavity:0",
      "max": [
        69.0,
        69.0,
        23.0
      ],
      "min": [
        41.0,
        41.0,
        8.0
      ]
    },
    {
      "clearance_mm": 1.0,
      "id": "cavity:1",
      "max": [
        124.0,
        71.0,
        25.0
      ],
      "min": [
        96.0,
        39.0,
        8.0
      ]
    },
    {
      "clearance_mm": 1.0,
      "id": "cavity:2",
      "max": [
        106.0,
        99.0,
        33.0
      ],
      "min": [
        54.0,
        74.0,
        23.0
      ]
    },
    {
      "clearance_mm": 1.0,
      "id": "cavity:3",
      "max": [
        159.0,
        66.0,
        25.0
      ],
      "min": [
        144.0,
        44.0,
        9.0
      ]
    }
  ],
  "document": {
    "document_id": "amd-credit-rib-pocket-experiment",
    "revision": 1,
    "sha256": "57bc227d8d2b5564f788da862f4a7df7f1dd6db85a7828037ca8b1b68dcf69ef"
  },
  "findings": [
    {
      "code": "APPROXIMATE_AABB_OPTIMIZATION",
      "message": "ROCm paths require exact host collision and structural checks.",
      "severity": "info"
    }
  ],
  "generator": {
    "authoritative_geometry": false,
    "device": "AMD Instinct MI300X VF",
    "name": "designstudio-rocm-support",
    "rocm": "6.4.43484-123eb5128",
    "seed": 20260726,
    "version": 1
  },
  "input_sha256": "6520b8aa358e9d15486cad5251aa76afbdfb91401f1c12840acbd980318b3a05",
  "required_host_checks": [
    "brep_valid",
    "exact_collision_free",
    "manufacturing_rules_pass",
    "structural_screening_pass",
    "assembly_order_pass"
  ],
  "result_sha256": "a11220ef70d7cdeedac1160a482aae4f0a0de73a097e9f5b469eae6859ca5ca4",
  "ribs": [
    {
      "anchor_id": "compute-support",
      "end_mm": [
        55.0,
        55.0,
        0.0
      ],
      "generator": "rocm-aabb-load-path-v1",
      "height_mm": 2.7,
      "id": "rib:compute-support:0",
      "start_mm": [
        55.0,
        55.0,
        10.0
      ],
      "thickness_mm": 1.341421
    },
    {
      "anchor_id": "compute-support",
      "end_mm": [
        55.0,
        55.0,
        0.0
      ],
      "generator": "rocm-aabb-load-path-v1",
      "height_mm": 2.7,
      "id": "rib:compute-support:1",
      "start_mm": [
        55.0,
        55.0,
        0.0
      ],
      "thickness_mm": 1.341421
    },
    {
      "anchor_id": "connector-load",
      "end_mm": [
        129.650314,
        19.224937,
        16.0
      ],
      "generator": "rocm-aabb-load-path-v1",
      "height_mm": 2.7,
      "id": "rib:connector-load:0",
      "start_mm": [
        148.0,
        55.0,
        16.0
      ],
      "thickness_mm": 1.423607
    },
    {
      "anchor_id": "connector-load",
      "end_mm": [
        148.0,
        0.0,
        16.0
      ],
      "generator": "rocm-aabb-load-path-v1",
      "height_mm": 2.7,
      "id": "rib:connector-load:1",
      "start_mm": [
        129.650314,
        19.224937,
        16.0
      ],
      "thickness_mm": 1.423607
    },
    {
      "anchor_id": "display-load",
      "end_mm": [
        80.0,
        86.0,
        0.0
      ],
      "generator": "rocm-aabb-load-path-v1",
      "height_mm": 2.7,
      "id": "rib:display-load:0",
      "start_mm": [
        80.0,
        86.0,
        27.0
      ],
      "thickness_mm": 1.412132
    },
    {
      "anchor_id": "display-load",
      "end_mm": [
        80.0,
        86.0,
        0.0
      ],
      "generator": "rocm-aabb-load-path-v1",
      "height_mm": 2.7,
      "id": "rib:display-load:1",
      "start_mm": [
        80.0,
        86.0,
        0.0
      ],
      "thickness_mm": 1.412132
    },
    {
      "anchor_id": "pcb-mount-ne",
      "end_mm": [
        142.0,
        22.0,
        3.0
      ],
      "generator": "rocm-aabb-load-path-v1",
      "height_mm": 2.7,
      "id": "rib:pcb-mount-ne:0",
      "start_mm": [
        142.0,
        22.0,
        6.0
      ],
      "thickness_mm": 1.311803
    },
    {
      "anchor_id": "pcb-mount-ne",
      "end_mm": [
        142.0,
        22.0,
        0.0
      ],
      "generator": "rocm-aabb-load-path-v1",
      "height_mm": 2.7,
      "id": "rib:pcb-mount-ne:1",
      "start_mm": [
        142.0,
        22.0,
        3.0
      ],
      "thickness_mm": 1.311803
    },
    {
      "anchor_id": "pcb-mount-nw",
      "end_mm": [
        18.0,
        22.0,
        3.0
      ],
      "generator": "rocm-aabb-load-path-v1",
      "height_mm": 2.7,
      "id": "rib:pcb-mount-nw:0",
      "start_mm": [
        18.0,
        22.0,
        6.0
      ],
      "thickness_mm": 1.311803
    },
    {
      "anchor_id": "pcb-mount-nw",
      "end_mm": [
        18.0,
        22.0,
        0.0
      ],
      "generator": "rocm-aabb-load-path-v1",
      "height_mm": 2.7,
      "id": "rib:pcb-mount-nw:1",
      "start_mm": [
        18.0,
        22.0,
        3.0
      ],
      "thickness_mm": 1.311803
    },
    {
      "anchor_id": "pcb-mount-se",
      "end_mm": [
        142.0,
        88.0,
        3.0
      ],
      "generator": "rocm-aabb-load-path-v1",
      "height_mm": 2.7,
      "id": "rib:pcb-mount-se:0",
      "start_mm": [
        142.0,
        88.0,
        6.0
      ],
      "thickness_mm": 1.311803
    },
    {
      "anchor_id": "pcb-mount-se",
      "end_mm": [
        142.0,
        88.0,
        0.0
      ],
      "generator": "rocm-aabb-load-path-v1",
      "height_mm": 2.7,
      "id": "rib:pcb-mount-se:1",
      "start_mm": [
        142.0,
        88.0,
        3.0
      ],
      "thickness_mm": 1.311803
    },
    {
      "anchor_id": "pcb-mount-sw",
      "end_mm": [
        18.0,
        88.0,
        3.0
      ],
      "generator": "rocm-aabb-load-path-v1",
      "height_mm": 2.7,
      "id": "rib:pcb-mount-sw:0",
      "start_mm": [
        18.0,
        88.0,
        6.0
      ],
      "thickness_mm": 1.311803
    },
    {
      "anchor_id": "pcb-mount-sw",
      "end_mm": [
        18.0,
        88.0,
        0.0
      ],
      "generator": "rocm-aabb-load-path-v1",
      "height_mm": 2.7,
      "id": "rib:pcb-mount-sw:1",
      "start_mm": [
        18.0,
        88.0,
        3.0
      ],
      "thickness_mm": 1.311803
    },
    {
      "anchor_id": "power-support",
      "end_mm": [
        110.0,
        55.0,
        0.0
      ],
      "generator": "rocm-aabb-load-path-v1",
      "height_mm": 2.7,
      "id": "rib:power-support:0",
      "start_mm": [
        110.0,
        55.0,
        10.0
      ],
      "thickness_mm": 1.358114
    },
    {
      "anchor_id": "power-support",
      "end_mm": [
        110.0,
        55.0,
        0.0
      ],
      "generator": "rocm-aabb-load-path-v1",
      "height_mm": 2.7,
      "id": "rib:power-support:1",
      "start_mm": [
        110.0,
        55.0,
        0.0
      ],
      "thickness_mm": 1.358114
    }
  ],
  "schema": "design-studio.support-result/1",
  "status": "pass"
}
